{
  "schemaVersion": "workflow-event-envelope.v1",
  "provider": "archon",
  "eventId": "evt_archon_workflow_engine_1_3b_002",
  "eventType": "workflow.run.completed",
  "occurredAt": "2026-07-11T12:25:00Z",
  "bindingRef": {
    "provider": "archon",
    "name": "workflow-engine-primary",
    "bindingId": "wpb_archon::workflow_engine_primary",
    "projectRef": "project:workflow-engine"
  },
  "workflowRunRef": {
    "provider": "archon",
    "runId": "archon-run-story-1-3b-001",
    "workflowName": "bmad-dev-story",
    "projectRef": "project:workflow-engine"
  },
  "projectRef": {
    "id": "workflow-engine",
    "codebaseRef": "workflow-engine",
    "repositoryPath": "${WORKFLOW_ENGINE_REPOSITORY_PATH}",
    "defaultBranch": "dev"
  },
  "idempotencyKey": "archon:workflow-engine-primary:evt_archon_workflow_engine_1_3b_002",
  "payload": {
    "state": "completed",
    "result": {
      "outcome": "accepted",
      "completedAt": "2026-07-11T12:25:00Z",
      "materializedArtifacts": [
        {
          "type": "contract-package",
          "uri": "file:_bmad-output/planning-artifacts/contracts/workflow-commander/README.md",
          "digest": "sha256:workflow-commander-contract-readme-digest",
          "name": "workflow-commander-contract-readme"
        }
      ]
    }
  }
}
