{
  "schemaVersion": "workflow-event-envelope.v1",
  "provider": "archon",
  "eventId": "evt_generic_workflow_engine_1_3b_105",
  "eventType": "workflow.artifact.recorded",
  "occurredAt": "2026-07-11T12:20:00Z",
  "bindingRef": {
    "provider": "archon",
    "name": "workflow-engine-primary",
    "bindingId": "wpb_archon::workflow_engine_primary",
    "projectRef": "project:workflow-engine"
  },
  "workflowRunRef": {
    "provider": "archon",
    "runId": "archon-run-story-1-3b-001",
    "workflowName": "bmad-dev-story",
    "projectRef": "project:workflow-engine"
  },
  "projectRef": {
    "id": "workflow-engine",
    "codebaseRef": "workflow-engine",
    "repositoryPath": "${WORKFLOW_ENGINE_REPOSITORY_PATH}",
    "defaultBranch": "dev"
  },
  "idempotencyKey": "archon:workflow-engine-primary:evt_generic_workflow_engine_1_3b_105",
  "payload": {
    "artifact": {
      "type": "contract-example",
      "name": "workflow-event-envelope.schema.json",
      "uri": "file:_bmad-output/planning-artifacts/contracts/workflow-commander/schemas/workflow-event-envelope.schema.json",
      "digest": "sha256:workflow-event-envelope-schema-digest"
    }
  }
}
