{
  "schemaVersion": "workflow-event-envelope.v1",
  "provider": "archon",
  "eventId": "evt_generic_workflow_engine_1_3b_103",
  "eventType": "workflow.approval.requested",
  "occurredAt": "2026-07-11T12:12:00Z",
  "bindingRef": {
    "provider": "archon",
    "name": "workflow-engine-primary",
    "bindingId": "wpb_archon::workflow_engine_primary",
    "projectRef": "project:workflow-engine"
  },
  "workflowRunRef": {
    "provider": "archon",
    "runId": "archon-run-story-1-3b-001",
    "workflowName": "bmad-dev-story",
    "projectRef": "project:workflow-engine"
  },
  "projectRef": {
    "id": "workflow-engine",
    "codebaseRef": "workflow-engine",
    "repositoryPath": "${WORKFLOW_ENGINE_REPOSITORY_PATH}",
    "defaultBranch": "dev"
  },
  "idempotencyKey": "archon:workflow-engine-primary:evt_generic_workflow_engine_1_3b_103",
  "payload": {
    "state": "waiting-for-approval",
    "approval": {
      "requestId": "approval_archon_1_3b_001",
      "requestedAction": "approve-or-reject",
      "phase": "dev-story-review",
      "requiredBy": "2026-07-12T12:12:00Z"
    }
  }
}
